{
  "id": "age-over-18",
  "version": 1,
  "category": "identity",
  "name": "Age over 18",
  "description": "A credential attesting that the holder is over 18, without disclosing a date of birth.",
  "format": "SdJwtVc",
  "bindMethod": [
    "JWK"
  ],
  "credSignAlgs": [
    "ES256"
  ],
  "proofSignAlgs": [
    "ES256"
  ],
  "expiration": 31536000,
  "bgColor": "#7ACCB1",
  "textColor": "#000000",
  "claimDefs": [
    {
      "path": [
        "age_over_18"
      ],
      "name": "Is Over 18",
      "dataType": "Text",
      "mandatory": true
    }
  ]
}
