{
  "id": "country",
  "version": 1,
  "category": "identity",
  "name": "Country",
  "description": "A credential attesting the country of residence of the holder.",
  "format": "SdJwtVc",
  "bindMethod": [
    "JWK"
  ],
  "credSignAlgs": [
    "ES256"
  ],
  "proofSignAlgs": [
    "ES256"
  ],
  "expiration": 31536000,
  "bgColor": "#FFEC99",
  "textColor": "#000000",
  "claimDefs": [
    {
      "path": [
        "address",
        "country"
      ],
      "name": "Country",
      "dataType": "Text",
      "mandatory": false
    }
  ]
}
