{
  "id": "email",
  "version": 1,
  "category": "identity",
  "name": "E-mail address",
  "description": "A credential attesting a verified e-mail address of the holder.",
  "format": "SdJwtVc",
  "bindMethod": [
    "JWK"
  ],
  "credSignAlgs": [
    "ES256"
  ],
  "proofSignAlgs": [
    "ES256"
  ],
  "expiration": 31536000,
  "logo": {
    "uri": "https://github.com/equs-ai/vc-schema-templates/blob/main/images/idv.png",
    "altText": "Logo"
  },
  "bgColor": "#2f4e73",
  "textColor": "#000000",
  "claimDefs": [
    {
      "path": [
        "email"
      ],
      "name": "Email",
      "dataType": "Text",
      "mandatory": false
    }
  ]
}